translated_cleaned_comment,is_toxic
объяснение почему изменение внести под мой имя пользователь hardcore metallica fan быть отменить это не быть вандализм а просто закрытие некоторый ga после тот как я проголосовать в fac new york dolls и пожалуйста не удалять шаблон с страница обсуждение так как я уже на пенсия,0
дауа он соответствовать этот цвет фон с который я похоже застрять спасибо разговор январь г utc,0
эй чувак я действительно не пытаться редактировать война просто этот парень постоянно удалять релевантный информация и разговаривать с я через правка вместо мой страница обсуждение казаться он большой заботиться о форматирование чем о фактический информация,0
более я не мочь сделать никакой реальный предложение по улучшение я быть интересно должный ли статистика раздел быть поздний или подраздел «тип несчастный случаев» » я думать что ссылка возможно нужно привести в порядок чтобы всё они быть в один и тот же формат то есть формат дата и так далее я мочь сделать это поздний если никто другой не сделать это первый если у вы есть какой либо предпочтение в отношение стиль форматирование в ссылка или вы хотеть сделать это самостоятельно пожалуйста дать я знать похоже что статья для рецензирование накопиться поэтому я предполагать что до появление рецензент мочь быть задержка он указать в соответствовать форма например википедия good article nominations transport,0
вы сэр мой герой есть ли шанс что ты помнить на какой это страница,0
и от я поздравлять хорошо пользоваться инструмент · говорить,0
член прежде чем ты помочиться на мой работа,1
ваш вандализм по отношение к статья мэтт ширвингтон быть отменный пожалуйста не делать это снова иначе вы забанить,0
извинить если слово чушь быть оскорбительный для вы в любой случай я не собираться ничего писать в статья ух ты они наброситься на я за вандализм я просто просить чтобы она быть более энциклопедический чтобы она можно быть использовать в школа в качество справочник я быть на страница селекционный разведение но это почти заглушка он указывать на «разведение животных» короткий запутать статья в который нет никакой информация должный быть кто то с знание евгеника,0
мировоззрение по этот вопрос и противоречащий позиция dulithgow,0
обоснование добросовестный использование изображение wonju jpg спасибо за загрузка изображение wonju jpg я заметить что на страница изображение указать что изображение использоваться в рамка добросовестный использование но нет никакой объяснение или обоснование тот почему он использование в статья википедия являться добросовестный использование помимо стандартный шаблон добросовестный использование вы также должный написать на страница описание изображение конкретный объяснение или обоснование тот почему использование это изображение в каждый статья соответствовать принцип добросовестный использование перейти на страница описание изображение и отредактировать она чтобы включить обоснование добросовестный использование если вы загрузить другой носитель добросовестный использование подумать о тот чтобы убедиться что вы указать обоснование добросовестный использование на этот страница вы мочь найти список страница с изображение который вы отредактировать щёлкнуть ссылка «мыть вклад» она находиться в сам верх любой страница википедия когда вы войти в система а затем выбрать «изображение» из раскрываться список обратить внимание что любой изображение добросовестный использование загрузить после май г и не иметь такой объяснение быть удалить через неделя после они загрузка как описать в критерий быстрый удаление если у вы есть какой либо вопрос задавать они на страница вопрос о авторский право сми спасибо обсуждение • вклад • неизвестный источник изображение wonju jpg спасибо за загрузка изображение wonju jpg я заметить что на страница описание файл в настоящий время не указать кто создать контент поэтому статус авторский право неясный если вы сам не создавать этот файл то вы нужно быть указать владелец авторский право если вы получить он с веб сайт то ссылка на веб сайт с который он быть взять вместе с повторный изложение условие использование он содержимое на это веб сайт как правило являться достаточный информация однако если правообладатель отличаться от издатель веб сайт они авторский право также должный быть признать помимо добавление источник пожалуйста добавить соответствовать тег лицензирование авторский право если в файл он ещё нет если вы создать снять изображение аудио или видео то тег можно использовать для они выпуск в рамка gfdl если вы считать что сми соответствовать критерий википедия добросовестный использование использовать тег такой как или один из другой тег перечисленный в википедия тег авторский право на изображение добросовестный использование смотреть «википедия тег авторский право на изображения» для получение полный список тег авторский право который вы мочь использовать если вы загрузить другой файл подумать о тот чтобы убедиться что вы указать они источник и также пометить они тег вы мочь найти список загрузить вы файл перейти по этот ссылка необработанный и непомеченный изображение мочь быть удалить через неделя после тот как они быть пометить как описать в критерий быстрый удаление если изображение защитить авторский право по несвободный лицензия согласно википедия добросовестный использование то изображение быть удалить через час если у вы есть какой либо вопрос задавать они на страница вопрос о авторский право сми спасибо обсуждение • вклад •,0
барбекю быть мужчина и давать обсудить это мочь быть по телефон,0
эй что это говорить что это эксклюзивный группа некоторый wp талибан который хорошо уметь уничтожать самозваный пурист который набивать любой кто задавать они вопрос о они антисоциальный и разрушительный не вклад в wp попросить ситюша привести себя в порядок а не делать я бессмысленный предупреждение,1
прежде чем вы начать бросать в я обвинение и предупреждение давать рассмотреть сам редактирование атака ad hominem не укрепить ваш аргумент а просто сделать вид будто вы злоупотреблять свой власть в качество администратор теперь актуальный сам редакция это наверное самый обсуждать событие в новость за последний время он отсутствие примечательно поскольку он единственный из ныне жить экс президент который не присутствовать это безусловно более примечательно чем то что он посвятить авианосец я намеренный отменить это изменение в надежда привлечь внимание администратор который желать взглянуть на сам проблема а не так обильно обвинять возможно если вы достигнуть такой уровень вежливость когда смочь это сделать мы смочь рационально обсудить этот тема и решить вопрос мирный путём,0
да и девушка выше начало с я спорить она сунуть нос туда где он не место я считать что спор быть между я и ивниммо но как я уже сказать ситуация уладиться и я извиниться спасибо,0
возраст джуэлза сантанас в год джуэлс сантан быть год затем наступить февраль когда джуэлс исполниться год когда он исполнять песня с the diplomats третий neff подписать на лейбл кэма под roc a fella в год он быть год когда он выпустить свой собственный сингл «santana s town» и «down» так что да он родиться в год он действительно как он мочь быть старший ллойд бэнкса а как он мочь быть когда он день рождение пройти хомячок нефф год смерть джуэлза не дать бог если вы о это думать равняться сходить к свой какулятор и перестать менять год он рождение мой бог,0
до свидание не смотреть приходить и не думать возвращаться тоссера,1
прямой разговор войдать поп георгиев чернодринский,0
точка зрение мицуруга не иметь смысл почему бы не поспорить о тот чтобы включить хинди на страница ре сакадзак чтобы добавить большой информация,0
не хотеть ты беспокоить я видеть что вы писать что то о удаление весь что разместить здесь и если вы это сделать хорошо но если нет и вы мочь обсудить это с я то даже хороший я хотеть бы попросить вы близкий познакомиться с категория преждевременный смерть в рестлинг и мужчина перечисленный в она несомненно этот человек принадлежать к какой то категория есть ли что нибыть что по ваш мы мочь сделать с категория кроме она удаление,0
что касаться ваш недавний правка ещё раз пожалуйста прочесть wp filmplot прежде чем редактировать какой либо статья из фильм ваш правка просто нехороший с слишком больший количество ненужный деталь и очень плохой написание пожалуйста остановиться прежде чем нанести дальнейший ущерб й год,0
хорошо знать о я да я сейчас учиться дипа,0
снежинка не всегда симметричный в раздел «геометрия» утверждаться что «снежинка всегда иметь шесть симметричный плеч» это утверждение просто неверно по слово кеннет либбрехт «довольный непривлекательный кристалл неправильный форма безусловно самый распространить разновидность» http www its caltech edu atomic snowcrystals myths myths htm perfection кто то действительно нужно взглянуть на он сайт и получить факт потому что я всё ещё видеть приличный количество ложность на этот страница простить я я новичок в это и не хотеть ничего редактировать,0
указатель сентябрь г прочесть этот указатель полностью один страница отписаться,0
пересмотр правка го абзац я не понимать причина недавний редактирование этот статья не потому что я уверенный что дать обязательно неверный скорее я убеждённый что стратегия введение академический награда в первый абзац таков бесполезный подход к этот конкретный тема я отмечать что статья о другой действовать судья быть аналогичный образ «улучшены» и я также считать что этот изменение не улучшать ситуация в поддержка мой мнение о тот что это изменение следовать отменить я бы пригласить любой повторно посетить статья написать о следующий пара юрист а бенджамин кардозо a выучить рука b джон маршалл харлан би джон маршалл харлан ii возникать вопрос быть ли улучшить текущий версия статья в википедия о один из они или любой пара за счёт академический данные в вводный абзац думать нет возможно это помогать повторить ироничный аргумент кэтлина салливана из стэнфордский право когда она предполагать что некоторый на юридический факультет гарвард задаваться вопрос как антонин скалиа избегать узнавать то что другой удаться понять о процесс суждение я надеяться что этот анекдот мягко иллюстрировать быть дело менее юмористический но ещё более сильный аргумент это тот аргумент который приводить кларенс томас когда он упоминать о желание вернуть свой юридический степень в йельский университет как минимум я сомневаться в это правка он заслуживать пересмотр,0
радиальный симметрия несколько ныне вымереть линия включить в echinodermata быть двусторонний например homostelea или даже асимметричный как cothurnocystis stylophora,0
не нужно извиняться статья в википедия предназначить для согласование знание о предмет из разный источник и я думать вы изучать история а не археология я мочь отсканировать страница отправить она вы по электронный почта а затем вы мочь бы попросить кто нибыть перевести страница,0
да потому что мать ребёнок в дело против майкл джексон изучать здесь мотив и довод и судить о она характер так же сурово как и сам вако джако не говорить я игнорировать это и оговорить себя я собираться и далёкий опровергать тот чушь который я бросать джайдж июнь г utc,0
около но это потребовать некоторый работа но я не мочь это представить у вы есть пример на который я мочь это обосновать утка,0
амбар для вы настоящий жизнь barnstar позволять мы быть звезда,0
как я мочь опубликовать сообщение до истечение срок блокировка самый смешной что вы думать что я вести себя невежливый,0
не уверить насчёт заголовок «борьба за свободу» что он быть содержать,0
хвалить посмотреть этот статья около месяц назад значительно улучшиться,0
я смочь опубликовать привести выше список так быстро потому что он у я уже быть в текстовый файл на мой жёсткий диск и я уже некоторый время собираться обновить список звук что касаться интерес я потратить четыре год пытаться привлечь большой интерес к свободно лицензированный полнометражный классический музыка к сожаление мой попытка не увенчаться успех я по прежний единственный кто это делать википроект классический музыка не заинтересовать wikipedia talk wikiproject classical music archive need help wikipedia talk wikiproject music archive i could use some helpwikipedia talk wikiproject music music music некоторый время назад список звук быть разместить на digg http digg com music wikipedia has free classical music downloads он получить копия что по имо очень впечатлять,0
ну не до процесс а до тот как мы делать что то с подстраница он rfa указать на страница noseptember и вы мочь найти он если посмотреть думать сентябрь год конечно у я есть отличие от el c но я быть удивлённый увидеть блок поэтому оставить записка так ц,0
вовсе нет здесь вы приводить соломенный аргумент я никогда не утверждать что у о донохью быть такой позиция скорее что практиковать и исследователь в этот область игнорировать позиция dsm что именно то о чем говориться в цитата а также то с чем о донохью соглашаться опять же я бороться с представление о тот что утверждать что педофилия это сексуальный ориентация быть «абсурдный частью» поскольку этот позиция придерживаться многие исследователь быть бы несправедливый назвать она абсурдный часть беспорядок разделить на область некоторый утверждать что это вовсе не беспорядок некоторый считать в конец конец это оценочный суждение как кантор указывать ранее в беседа а не научный суждение если мы решить сделать это оценочный суждение в статья оно должный быть чётко сформулировать и не претендовать на научный обоснование,0
