translated_cleaned_comment,is_toxic
объяснение почему редактировать редактация под мой имя пользователь hardcore metallica fan быть отремонтировать они не быть вандализм просто закрытие на некоторый ga после тот как я проголосовать в нью йорк куклс fac и пожалуйста не удалить шаблон с страница разговор так как я уйти сейчас,0
d aww он соответствовать этот цвет фон с который я казаться бы застрять спасибо talk январь utc,0
эй человек я действительно не пытаться редактировать война это просто что этот парень постоянно удалять актуальный информация и говорить с я через редактирование вместо мой страница разговор он казаться заботиться большой о форматирование чем актуальный информация,0
» большой я не мочь сделать реальный предложение по улучшение я задаваться если статистика раздел должный быть поздний или подраздел тип авария я думать что ссылка мочь нуждаться в умирание чтобы они всё в точный тот же формат ie дата формат и так далее я мочь сделать это поздний если никто другой не делать в первый очередь если у вы есть какой либо предпочтение для форматирование стиль на справка или хотеть сделать это самостоятельно пожалуйста дать я знать появиться что бэклога на статья для рассмотрение поэтому я думать что мочь быть задержка пока рецензент не получиться он указать в соответствовать форма eg wikipedia good article nominations transport,0
ты сэр мой герой любой шанс на который вы помнить на какой страница,0
» поздравлять с я использовать инструмент хорошо · говорить,0
коксусера до вы писса вокруг на мой работа,1
ваш вандализм в статья мэтт ширвингтон быть отремонтировать пожалуйста не делать это снова или вы быть запретить,0
извинить если слово «необзор» быть оскорбительный для вы в любой случай я не намеренный писать что нибыть в статья то есть они быть прыгать на я для вандализм я просто запрашивать что это быть большой энциклопедия так что один мочь использовать он для школа в качество справка я быть на селективный страница разведение но это почти паб он указывать на «живой разведение» что являться короткий грязный статья который давать вы никакой информация должный быть кто то вокруг с опыт работа в евген,0
выравнивание на этот тема и который противоречить тем из dulithgow,0
» ярмарка использование рационализатор для изображение wonju jpg спасибо за загрузка изображение wonju jpg я замечать что страница изображение использоваться в честной использование но нет объяснение или рациональный почему он использование в статья википедия являться справедливый использование помимо шаблон использование деревянный плита вы также должный написать на страница описание изображение конкретный объяснение или рационализировать для почему использование это изображение в каждый статья соответствовать справедливый использование пожалуйста перейти на страница описание изображение и отредактировать он чтобы включить справедливый рациональный использование если вы загрузить другой сми считать что вы указать справедливый рациональность использование на этот страница вы мочь найти список изображение страница который вы отредактировать нажать на ссылка мые вклад это расположить на сам верхний угол любой страница википедия когда вы войти в система а затем выбрать изображение из выпадать ящик обратить внимание что любой изображение загрузить после май год и не хватать такой объяснение быть удалить через неделя после тот как они быть загрузить как описать по критерий для скорый удаление если у вы есть какой либо вопрос пожалуйста задавать они на страница «сми» авторский вопрос спасибо talk • путешествовать • неопределённый источник для изображение wonju jpg спасибо за загрузка изображение wonju jpg я заметить что страница описание файл в настоящий время не указывать кто создать контент поэтому статус авторский право неясный если вы не создать этот файл самостоятельно то вы нужно быть указать владелец авторский право если вы получить он с сайт то ссылка на сайт с который он быть взять вместе с восстановление условие использование это сайт обычно являться достаточный информация однако если правообладатель отличаться от издатель сайт то они авторский право также должный быть признать а также добавить источник пожалуйста добавить правильный тег лицензирование если файл уже не иметь один если вы создать посмотреть картина аудио или видео то тег мочь быть использовать для освобождение он под gfdl если вы считать что сми соответствовать критерий в википедия использование пара использовать тег например или один из другой тег перечисленный в википедия изображение авторский тег справедливый использование смотреть википедия изображение авторский тег для полный список авторский тег который вы мочь использовать если вы загрузить другой файл рассмотреть проверка тот что вы указать они источник и с метка они тоже вы мочь найти список файл который вы загрузить перейти по ссылка этот ссылка непризнанный и незамеченный изображение мочь быть удалить через неделя после тот как они быть с метка как описать по критерий для скорый удаление если изображение защитить авторский право по безлимитный лицензия на википедия справедливый использование то изображение быть удалить через час после если у вы есть какой либо вопрос пожалуйста задавать они на страница «сми» авторский вопрос спасибо talk • путешествовать •,0
bbq быть мужчина и позволять обсудить он мочь по телефон,0
эй что это такой говорить что это эксклюзивный группа некоторый wp talibans кто хороший при уничтожение самоназначить лучник который gang up любой кто задавать они вопрос абт они антисоциальный и деструктивный не сопровождение на wp спросить ситушить чтобы очистить он поведение чем выдать я несеничный предупреждение,1
прежде чем вы начать бросать обвинение и предупреждение на я давать рассмотреть сам редактировать атака хомеум не собираться усилить ваш аргумент это просто заставить он выглядеть так как вы оскорблять свой власть как админ теперь сам редактировать являться актуальный это вероятно один наиболее говорить о событие в тот что он новость поздравление он отсутствие можно заметить поскольку он единственный живой экс президент который не присутствовать это конечно более заметно чем он преданность авиаперевозчик я намеренный перевернуть это редактирование в надежда привлечь внимание админ который готовый посмотреть на сам вопрос а не бросать обвинение вокруг довольно так либерально возможно если вы достигнуть уровень гражданский жизнь где мочь это сделать мы мочь иметь рациональный дискуссия по тема и решить вопрос мирно,0
о и девушка выше начало свой аргумент с я она застрять нос где он не принадлежать я считать что аргумент быть между я и yvesnimmo но как я сказать ситуация быть урегулировать и я извиниться спасибо,0
» юэльс сантанас возраст в год юэльс сантан исполниться год затем прийти февраль что делать juelz поворот делать песня с дипломат третий нефф должный быть подписать на этикетка cam под roc a fella в год он быть год выходить из собственный сингл сантан и стоун так что да он родиться в год он действительно как он мочь быть старший чем lloyd banks и как он мочь быть когда он день рождение пройти неф гомие год смерть джуэльс бог запрещать если вы думать о это равняться перейти в свой каккулятор и прекратить менять год рождение мой бог,0
поесть не смотреть приходить или подумать о тот чтобы вернуться тоссера,1
редиректор поговорить войдать поп георгиев чернодринский,0
точка мицуруга не иметь смысл почему бы не утверждать что включить хинди на страница рё саказак чтобы включить большой информация,0
не значит вы беспокоить я видеть что вы писать что то относительно удаление что либо опубликовать здесь и если вы хорошо oh но если не и вы мочь в итог обсудить это с я то даже хороший я хотеть попросить вы приблизиться к преждевременный борьба с смерть и мужчина перечисленный в немой уверенный что этот мужчина принадлежать вместе в некоторый катагорский дело есть ли что нибыть что вы думать что мы мочь сделать с катагория кроме дельтинг,0
» что касаться ваш последний правка ещё раз пожалуйста прочитать wp filmplot перед редактирование ещё большой стать фильм ваш редактация просто не хороший с совершенно слишком много ненужный деталь и очень плохой написание пожалуйста остановиться прежде чем вы быть делать дальнейший повреждение,0
» хорошо знать о я да я изучать сейчас дипа,0
» снежинка не всегда симметричный под геометрия сказать что «снежинка всегда иметь шесть симметричный рук» это утверждение просто не верно согласно кеннетта либбрехт чем неактивный нерегулярный кристалл далеко самый распространить разнообразие http www its caltech edu atomic snowcrystals myths myths htm perfection кто то действительно нужно взглянуть на он сайт и получить facts из он потому что я всё ещё видеть достойный количество богослужение на этот страница помощь я im new на это и не хотеть отредактировать что нибыть,0
» дата регистрация сентябрь прочитать этот signpost в полный объём одностраничный отписаться »,0
» переосмысление го абзац редактирование я не понимать причина s недавний редактирование этот статья не то что я уверенный что дать обязательно неправильно вместо это я убеждённый что стратегия внедрение академический почётный дело в первый пункт являться непохожий подход к этот конкретный тема отметить что статья о другой сидение правосудие быть аналогичный объясняться и я также считать что этот изменение не улучшаться в поддержка мой просмотр этот редакт должный быть отменный я бы приглашать весь на повторно визатить статья написать о следующий пара жюри a бенджамин кардозо a изучение рука b джон маршалл харлан b джон маршалл харлан ii вопрос становиться быть ли актуальный версия статья википедия о любой из они или либо пара улучшить академический учётный данные в вводный пункт я думать нет возможно это помогать повторить аргумент вишня катлина сулливана стэнфорд закон делать когда она предлагать что некоторый на факультет гарвард ю интересно как антонин скали избегать изучение тот что другой удаться понять о процесс судейство я бы надеяться что этот анекдот нежно иллюстрировать точка маленький юмор но ещё более сильный аргумент это один кларенс томас делать когда он упоминать что хотеть вернуть свой законный степень в ял как минимум я спрашивать это редактирование это заслуживать тот чтобы быть переосмыслить »,0
радиальный симметрия несколько сейчас вымереть лайнер включить в echinodermata быть двусторонний такой как homostelea или даже асимметричный такой как cothurnocystis stylophora,0
нет необходимость извиниться википедия статья сделать для реконсации знание о предмет из разный источник и вы сделать исследование история и не археология я думать я мочь бы отсканировать страница написать она вы а затем вы мочь попросить кто то перевести страница,0
да потому что мать ребёнок в случай против майкл джексон быть изучить в здесь мотив и рассуждение и судить по она характер так же сурово как сам вакко джёкий не сказать что я игнорировать он и преступить себя я собираться продолжать отказать бульшитый что джейджг держать бросать на я июн utc,0
» около но это занять немного работа но я не мочь это сделать у вы есть пример на который я мочь он основать утка,0
барнстарый для вы реальный жизнь barnstar позволять мы быть звезда »,0
как я мочь разместить до окончание блок смешной вещь ты думать что я ненавидеть,0
не уверить в рубрика «борьба за свободу» что она быть содержать,0
хвала смотреть на этот статья около месяц назад много улучшить » » » »,0
я смочь опубликовать выше список так быстро потому что я уже иметь он в текстовый файл в мой жёсткий диск я иметь смысл получить вокруг для обновление список звук в течение некоторый время теперь до тот пора как генерировать интерес я провести четыре год пытаться разбить большой интерес к свободно лицензированный полный длина классический музыка к сожаление мой попытка не удаться я всё ещё эффектно единственный кто это делать классический музыка википроект не быть заинтересовать wikipedia talk wikiproject classical music archive need help wikipedia talk wikiproject music archive i could use some helpwikipedia talk wikiproject music archive raul c theandic list list ssssssssssic com lsssssf lsssssf lwiki lwiki lwiki lwiki lwiki f lwiki f f f f f f f f lwiki wiki wiki wiki lwiki lwiki f f f f wikip wiki f wikip wikip wikip wikip wikip wikip так что я действительно дать пытаться заинтересовать другой звуковой список быть показать на digg a while back http digg com music wikipedia has free classical music downloads он получить дигггга что являться imo очень впечатляющий,0
» ну не перед процесс но перед тем как мы делать вещь с подстраница он rfa перечислить на страница noseptember и вы мочь найти он если вы посмотреть сентябрь я думать у я есть мой различие с el c чтобы быть уверенный но быть удивлённый чтобы увидеть блок так что я оставить примечание t c,0
» не совсем вы делать аргумент человек солома здесь я никогда не утверждать что о донохуэ иметь этот позиция скорее что практиковать и исследователь в область игнорировать позиция dsm который именно то что цитата говорить а также что то о доноуэ согласный с опять же я быть бояться понятие что это быть ««абсурдный часть»» чтобы утверждать что педофилия являться сексуальный ориентация поскольку многие исследователь удерживать этот позиция это быть бы несправедливый чтобы вызвать он абсурд разрешение часть делиться в поле некоторый утверждать что это не расстройство вообще некоторый делать в конец день это ценный суждение как кантор указать ранее в тема а не научный суждение если мы решить это значение в статья то следовать чётко и не претендовать на научный основание »,0
