translated_cleaned_comment,is_toxic
я удалить контент после тот как он быть пометить как ненавязчивый mattisse если каждый общеизвестный факт нуждаться в цит потому что какой то пропускной пункт хотеть называть для farc то он появляться у мы есть проблема я очень подозревать мотив маттиза здесь но откровенно я слишком устать от она чтобы быть беспокоить чтобы исследовать они возможно один из она пробатитарный ментор более заинтересованный в она чем я не быть заботиться о это,0
джефф гарсия гей или нет,0
это не быть бы достаточно вы нужно явный разрешение на использование текст защитить кто то другой под лицензия подходящий для википедия пожалуйста прочитать руководство по запрос и оформление разрешение на использование авторский право на википедия обратить внимание что в дополнение к требование к авторский право статья должный всё ещё соблюдать правило юриспруденция запрет на реклама и избегать конфликт интерес — говорить,0
раздел полезный для информация и должный оставаться вы явно неправый,0
комментарий теперь мы застрять с неделя сломить ссылка так как вы подтверждать что переезд быть ошибка и не противоречивый вы быть он перезагрузить если кто нибыть хотеть спорить что опера являться основной тема они мочь сделать это под правильный запросить движение обсуждение как они должный быть сделать в первый очередь если вы не готовый или не способный это сделать сегодня я попрося другой администратор сделать это,0
» необходимо также включать в контекст год я попробовать и копа некоторый источник пользователь talk обозревать я,0
тим в первый я ценить что вы наслать время чтобы обсудить этот вопрос офлайн и для ваш готовность обсудить он по длина здесь несмотря на большинство взгляд здесь находиться в ваш выгода да я конечно согласный с ваш друг что очень важно описать юрисдикция который присутствовать фирма есть явно массовый различие между сказать иметь офис в французский или японский юрисдикция или между китайский и американский юрисдикция поскольку правовой и нормативный система очень разный а также коммерческий характеристика рынок кроме тот это оставаться мой твёрдый цель что между юридический фирма есть больший разница в который находиться офис сказать париж или тулуза хотя они оба в тот же юрисдикция я ценить что ситуация в сша немного сложный так как у вы есть как федеральный так и государственный юрисдикция даже в каждый государство быть больший различие между юридический рынок в разный город чтобы дать пример рынок san jose быть не просто намного маленький чем рынок лос анджелес но он также быть иметь довольно другой профиль на всё гораздо большой специалист ниша и сосредоточить на высокий технология чтобы дать ещё один пример в великобритания юридический фирма никогда не мочь рассматриваться как действительно верхний уровень если у он не быть офис в лондон даже если бы у он быть офис в каждый большой город на сам дело всё очень хороший компания айтр великобритания dla piper ещё не считаться один из они несмотря на он размер иметь только один офис великобритания в лондон хотя у они есть другой офис за рубеж говорить что dla иметь иметь офис по весь сша египет южный африка кения таиланд китай в мой обзор всё ещё означать потеря ценный информация читатель мы мочь бы вернуться к использование описание такой как «в крупный финансовый центрах» или «в крупный коммерческий центрах» или «в комбинация крупный финансовый центр и крупный коммерческий центров»» но затем мы вводить то что находиться в мой обзор ненужный элемент изумление неточность и даже оригинальный исследование я принимать что dla с офис находиться прямо на граница иметь слишком много офис чтобы сделать он практичный чтобы перечислить всё из они в статья однако я также чувствовать что есть важный общий пункт который информация о офисный место юридический фирма являться очень ценный информация чтобы помочь читатель статья в понимание предмет он и должный быть включить как можно большой »,0
никакой проблема с это вообще если вы не думать что есть проблема с кто то сидя что у я есть любовница то это просто доказывать мой пункт как до сей пора этот сайт являться фактический энциклопедия это форум а не энциклопедия больший разница и это даже не то что я пугать большой весь о мой страница спасибо бог я одинокий без цыплёнок стереть я или это быть бы другой адвокатский сбор я бы передать кто владеть это сайт я делать стереть о хозяйка весь мой страница иметь ошибка с сам первый строка вниз до сам последний строка и это не шутка первый линия и последний строка ошибаться,0
sprecher пивоваренный завод я взять тур этот рождество когда посещать мой сестра за стекло мы заряжать дополнительно они сайт не мочь быть обновить но это текущий ценообразование,0
ipad страница разговор почему вы удалить что ip редактирование на страница разговор это не спам,0
» скорый удаление эндрю такао метка быть разместить на эндрю такао спрашивать что она быть быстро удалить из википедия это быть сделать в раздел a критерий для скорый удаление потому что статья появляться о человек или группа человек но не указывать как или почему предмет являться заметный то есть почему статья о это предмет должный быть включить в энциклопедия по критерий ускорение удаление статья не указывать на важность или значение тема мочь быть удалить в любой время пожалуйста ознакомиться с рекомендация который обычно приниматься как можно более заметный так и наш предметно специфический руководство по совместимость для биография если вы считать что это уведомление быть разместить здесь в ошибка вы мочь раскрыть удаление добавить в верхний часть страница просто ниже существующий скоростной удаление или db тег в сочетание с добавление записка на страница разговор объяснять ваш позиция но иметь что когда то пометить для скорый удаление если статья соответствовать критерий он мочь быть удалённый без задержка пожалуйста не удалить наиболее быстрый удаление но не стесняться добавлять информация в статья который бы оказать бы большой в соответствие с политика и рекомендация википедия »,0
» изображение предупреждение о утешение изображение изображение metroid prime hunter title screen top display jpg быть указать в википедия изображение и медиа для удаление если вы чувствовать что это изображение не должный быть удалить пожалуйста зайти туда чтобы озвучить ваш мнение август г utc,0
реальный личный атака это повторяться отключение мой правка весь остальной,0
» ноп я не читать руководство по обжалование не быть время пользователь в вопрос заниматься домогательство я делать это достаточно долго чтобы знать и я мочь доказать это он она сразу же установить грозный уведомление о блокировка я постоянно на мой страница пользователь перевернуть статья пока я быть в разгар редактирование он мой второй проход не смочь даже предпросмотрить изменение затем изменить он она ум как к мой реальный wiki sin поскольку он для доказаний день дорис доступный как pd в архив org быть на немой она не я и обычный шп для pre bern истечь долго решить мой real грех быть первоначально и и не быть продолжаться что он не быть и не быть продолжать или добавить клот конечно это мочь но если пользователь в вопрос быть really обеспокоить тем что о качество статья и о посторонний деталь почему didn t he she even notice два параграф уже там в тот число около весь статья разобраться с норман шварцкопф не связанный книга и не связанный с мороженое имя магазин я сказать вы почему пользователь не заниматься хороший хороший редактирование и нормальный назад и тем что приводить к хороший статья он она участвовать в блокирование вход в статья почему быть ли это лично для я или это быть чтобы сохранить существующий содержание статья включая ложный претензия и посторонний материал даже не обеспокоить тема ар я мочь только спекуляция но я бы думать что это некоторый вид командировка и wiki bullying у я нет время для это я сделать достаточный количество очень хороший правка в течение многий год и обычно воздержаться от высказывание что то что не напрямую связать с содержание и улучшение стать я мочь бы предпосылать этот пользователь не делать то что он она сделать но я тратя свой время здесь и у я нет доля в любой такой претенсия у я нет доля в улучшение этот статья нет собака в гонка я просто видеть как это можно улучшить и сделать более информативный как долгосрочный википедия пользователь и редактор я не видеть никакой проблема в прыжок и что то исправить я почти ожидать что некоторый отталкивать сейчас но не более совершенно незначительный правка который очень хороший и нацеливаться в очень незначительный стюб подобный статья проблема здесь не так что если человек такой как пользователь в вопрос мочь уйти с такой поведение и они уходить с они википедия становиться гораздо бедный место игровой площадка заполнить бук а не библиотека где мы мочь всё учиться и делиться также я не переназывать он она бот я думать что вы ставить этот слово в рот возможно ненавязчивый он поведение злонамеренный но вероятно не вредоносный по просто нормальный человеческий коллекция проблема я думать что этот пользователь должный быть предупресть против попытка быть вратарь он она не достаточно квалифицированный для это в любой случай и он иметь очень охлаждать эффект через википедия я не быть убеждать в бой акроним правило википедия я быть продолжать писать на английский язык и читать статья на википедия на английский язык и думать о способ они улучшить на английский язык я в полный мера осознавать как термин «вандлизм» использоваться и неправильно использоваться здесь и большинство остальной часть викияргон здесь ничего новый под солнце если вы внимательно прочитать правка который я сделать и обратить внимание на время ревертов и история действие другой пользователь вы увидеть что я не отметка здесь вообще я знать что происходить я не знать почему но я не нужно и я ожидать что мотивация не интересный отвечать если у вы есть что сказать »,0
коммунистический состояние всё три называть себя социалистический государство коммунист это слово который более западный использование так что имя должный быть изменить,0
боз хеландига журналист интервьюер и писатель прежде весь нисхип о гомосексуалист голливуд,0
» содержимое мвдб являться пользователь подавать и часто подлежать неправильный спекуляция и слух использование imdb на википедия для референция считаться неприемлемый и сильно неуважаемый » википедия википроект фильм ресурс самопубликовать сми в основное не приемлемый это включать в себя любой веб сайт содержание который в основное являться пользовательский включая база данные интернет фильм imdb wp userg как я уже говорить это давний консенсус если вы не согласный я призывать вы принять он в википедия надёжный источник ноттикеборд,0
я новичок в это средство общение и я не уверенный что я выражать это в правильный форма однако я пересматривать всё последний номинация ma ожидаться перейти в интернет в близкий пара месяц в процесс я разработать база исправить лата длинный мёртвый степень на основа google earth и фото и карта оценщик в архив номинация я бы хотеть поделиться это если есть способ сделать это в качество альтернатива чтобы найти способ easily проверить и исправить существующий координата на список mass wiki быть ли это полезно для кто нибыть,0
ykgtp фактически перевернуть вандализм я не,0
да я прочитать они оба и я теперь быть просить вы предоставить резервный копия для ваш история не то что это иметь значение по крайний мера один религия так же плохой как и другой но у вы хороший есть доказательство для ваш претензия чатnoir,0
я думать что ошибка заключаться в тот что это грамм не килограмм так кг я редактировать статья чтобы у мы быть хороший результат если я не ошибаться пожалуйста изменить он обратно dec utc,0
винс fyi yellowfrogs лонгдендейл советник шон паркер перерисовать частый кошельк «greenwash» и четыре площадь за разрушение swallows wood через он поддержка для обход он очень воссоздавать страница википедия на longdendale bypass он собственный и страница рой стархам чтобы увеличить он поддельный «зеленые» учётный дать и обфускатя нейтральность этот стать он получать неприятный если он отбиваться увеличить судебный действие но к счастие он юридически неграмотный поэтому не откладывать,0
описание для «ситуация пользователь shimshem взять нелюбимый в этот статья и попробовать множество метод чтобы либо удалить она либо он имя измениться полностью недействительный запрос на удаление скорость недействительный drv запрос назначить для удаление через afd несмотря на то что он пройти afd в это год на сам дело afd быть вывести в для keep текущий afd здесь стоить на для keep но несмотря на то что shimshem всё это проникнуть как только стать ясно что он собираться быть сохранить они решить изменение название быть бы хороший изменить название группа в статья и быть сказать чтобы взять он чтобы поговорить после краткий необсуждение на разговор переместить статья в любой случай и быть отменный я изначально не быть уверенный мотив это редактор почему они быть полностью отчаять для удаление или перемещение этот статья до тот пора пока я не заметить что они быть заинтересовать в предмет тамил один из который m i a художник и догадаться что они поверить что два мочь быть запутать они последующий создание статья m i a как перенаправить на m i a артист доказать это насколько я обеспокоить что касаться тот на сам дело группа называться mia или m i a она отличаться сам группа использовать m i a как заголовок на собственный сайт но затем использовать комбинация оба в друг место поскольку в случай большинство источник это вероятно быть ленивость например r e m регулярно называть rem и поскольку статья существовать здесь на некоторый время и что всё обратный ссылка идти на этот версия и большинство из весь потому что мы не должный позволить разрушительный пользователь получить они путь статья должный остаться здесь,0
