translated_cleaned_comment,is_toxic
июль г utc что ж да это нормально но дело в тот что в это предложение нет никакой заявление издатель ни о чем идея наличие ресурс заключаться в тот что мы копировать то что говорить ресурс а не просто перечислять они в качество ссылка если на ресурс написать «джо у червей» то мы писать «джо есть червей» дело не в тот чтобы запятнать любой репутация что касаться общепринятый практика в издательский мир то это википедия и принять практика охватываться тем что мы называть «политика и» «руководящий принципами» » поскольку они возникнуть в течение длительный период время и в процесс консенсус что касаться человек который вести учёт тот сколько книга быть издать я думать вы упустить быть журнал publisher s weekly например содержать информация о количество книга они вторичный источник вы видеть чем это отличаться что касаться статья о fip у она вообще не быть никакой источник что являться один из причина она удаление единственный ссылка который он иметь внизу быть ссылка смотреть также который указывать на этот статья здесь и на другой статья который также не быть источник за исключение ссылка на этот статья здесь fip и acim org это один и то же лицо facim также являться тот же организация это известно наличие один и тот же совет директор а также использование один и тот же зарегистрировать товарный знак «acim®» и так далее делать что либо из любой из этот веб сайт первоисточник,0
тим здесь нет последовательность хотя конечно она должный быть я думать вы мочь бы провести полезный обсуждение либо на страница обсуждение проект «биография» либо на доска объявление британский википедист «википедия» дать я знать если вы добиться прогресс,0
сезон футбол в барселона начало век я смотреть футбольный сезон «барселоны» который вы добавить и ещё несколько сезон после они они действительно мочь справиться я не думать что это стоить перечислять на wp pnt но это должный дать они понять так или иначе а если нет это можно быть бы добавить на они страница обсуждение я не хотеть делать это сам а потому что я ленивый и б потому что я ничего не знать о футбол и вероятно сделать ошибка в перевод,0
трахнуть ты педик я не волновать если я заблокировать пока всё знать что ты тупой пизда,1
отвечать на вопрос у я не быть возможность поздороваться или попрощаться когда я заблокировать забанить что то ещё ну здравствуй я не затаить дыхание когда кто то быть отвечать на ваш вопрос относительно страница dawn well в wiki и я хороший попрощаться так как я чувствовать что жить как майский муха в комната с низкий потолок полный лягушка быков не потому что я ошибаться а потому что любой кто находиться на ваш сторона подвергнуться нападение и быть склонный к некоторый нарушение нарушение который быть проигнорировать кто то кто они нравиться но нарушение который быть достойно казнь если оно быть совершить я »,0
вопрос onefortyone причина по который я удалить ваш правка потому что у они есть следующий проблема именно грейсленд являться второй по посещаемость место в сша не biltmore estate «декор в весь дом часто подвергаться критике» »неверно он никто не критиковать затем вы помещать цитата альберт голдман сторонник теория элвис пресли и добавлять они в graceland basement что не иметь отношение к дело этот «противоречивый сообщения» о он смерть не иметь отношение к этот статья особенно когда они оспариваться или отвергаться достаточно много раз вот почему такой контент вводить в заблуждение и должный быть удалённый я также не видеть консенсус относительно добавление он в архив или предыдущий обсуждение,0
в такой случай быть ли хотя бы приемлемый «ние эйдж» friend,0
мистер вольф мы нужно серьёзно поговорить о астма вы читать что нибыть о астма бета адренергический теория единственный теория астма который мочь быть связать с один имя не считать псих поэтому ваш вопрос о другой имя оскорблять мой интеллект не только это но и в отличие от другой теория на этот теория цитировать большой чем на любой другой статья в история journal of allergy согласно garfieled library в университет пенсильвания и последний но не менее важный мой комментарий быть бы неуместный в раздел история потому что он напрямую относиться к полиморфизм ba поскольку другой полиморфизм не мочь быть связать с конкретный теория тем более с конкретный человек ваш комментарий не иметь никакой смысл,0
«обратить внимание что далее петерсон начать обвинять я в вандализм за редактирование этот сам страницы« адвокат ребёнок в терапия » я решить отредактировать попросить цитата для« факт » который он опубликовать на страница как это мочь быть вандализм похоже он мочь грубо нарушать политика и руководящий принцип wiki но любой разумный попытка заставить он оправдать это являться «вандализмом»,0
белоголовый орлан я рассмотреть всё ваш вопрос привет джуда,0
сара вы он удалить но он остаться я написать в надзорный служба несколько час назад они просто ответить сказать спасибо и команда скрыть информация это оставаться,0
рэнд пол вы следить за ранд пол в противный случай вы мочь удалить шаблон с страница обсуждение спасибо,0
плохой обоснование afd википедия статья для удаление средний школа джо э ньюсом википедия статья для удаление обзор обои видеть,0
обоснование добросовестный использование изображение оспаривать в статья вика макглинный бот betacommand бросить вызов статья вика макглинный это кадр с низкий разрешение сделать веб камера в студия bbc music затем я отредактировать фотография сделать новый и загрузить она речь идти о изображение image vicmc jpg это добросовестный использование пожалуйста порекомендовать спасибо боб,0
пример старый протезирование как римский нога капуя или египетский протезирование,0
извинить я не понимать что всё что вы удалить являться антисемитский вы прийтись оправдывать подобный обвинение,0
кавортинг с еретик к черта еретик,1
ха в ваш комментарий не быть нарушение blp я никто ничего не звонить ваш злоупотребление инструмент администратор жалко и трусливо забавно как я говорить о фашист контролировать статья gamergate а вы полностью удалять она из история вы только что доказать мой точка зрение единственный что я действительно сделать это связать с предполагать угроза смерть который брианна ву продавать средство массовый информация что доказать что это быть полный выдумка в это ваш проблема вы не хотеть чтобы ваш ложь против gamergate быть разоблачить,1
благодарность спасибо но я знать,0
держать пропаганда далёкий от этот статья вы просто ещё один интернет тролль,0
отказ от быстрый удаление принц череп привет swimnteach я просто сообщать вы что я отказаться от скорый удаление skull prince страница который вы пометить для быстрый удаление из за следующий проблема вымышленный a не применяться я мочь удалить это как спам спасибо соединить королевство,0
эван рэйчел вуд есть ли доказательство тот что она еврейка,0
человек мы отчаянно нуждаться в консенсус здесь мочь ли мы всё проголосовать за один из следующий вариант учитывать что есть три вариант я думать что большинство быть достаточно у некоторый вариант есть второстепенный опрос пожалуйста проголосовать ещё раз в каждый из этот дополнительный опрос,0
ссылка по тема фанат весь привет я знать что некоторый из вы возможно счесть мой добавление на это сайт раздражающий точнее то что я привести ссылка на ролик мой друг на youtube где он поделиться свой свежий впечатление о фильм сразу после он просмотр позволить я просто сказать что мой друг очень предать поклонник о чем даже свидетельствовать новостной ролик и хотя он комментарий мочь показаться немного необычный я думать они интересный тем что они говорить уникальный способ который фанат мочь смотреть фильм что касаться нарушение авторский право или несоответствие я уже говорить о тот насколько клип актуальный поэтому я сказать что я нужно по ip проработать несколько год в фирма заниматься интеллектуальный собственность а теперь быть студент юридический факультет я убеждённый на основание тот что я знать о закон что этот клип не нарушать никакой право на фильм а также любой нарушение который иметь место до сей пора к он обратиться команда новость abc для выпуск свой история итак пожалуйста мочь ли мы попытаться договориться или прийти к какой то соглашение что быть нормально оставить этот клип я новичок в редактирование вика но считать что этот клип стать хороший дополнение к сайт о человек паук я уверенный что многий фанат это показаться забавный и интересный мягко говорить так что вы сказать народ,0
мстительный мой чувство честь задеть ваш злобный внимание быть надеяться на возвращение вежливость,0
wikiproject new zealand класс c важность низкий политика да политический важность низкий,0
изменить в год canwest выпустить успешный первичный публичный размещение акция на фондовый биржа торонто включая акция с несколько голос если бы у cnn быть несколько голосовать акция разве это не быть бы существенный факт,0
никакой предположение или использование правило синтез например тип a b c нет где это использоваться как вы прислать к вывод что он использовать не быть несмотря на то что мочь быть способ он использование для обобщение и приравнивание я не использовать он в википедия только потому что здесь он не действительный а теперь прекратить обвинение,0
скорый удаление создатель школа пожалуйста воздержаться от добавление в википедия неприемлемый страница такой как создатель школа это противоречить наш правило если вы хотеть поэкспериментировать воспользоваться песочница если вы считать что это уведомление быть разместить здесь по ошибка вы мочь оспорить удаление добавить он вверху статья чуть ниже существующий быстрый удаление или тег «db» вместе с добавление примечание к обсуждение статья страница объяснять ваш позиция но иметь в вид что после тот как статья быть пометить для быстрый удаление она мочь быть удалить без промедление если она соответствовать критерий пожалуйста не удалять тег быстрый удаление самостоятельно но не стесняться добавлять в статья информация который сделать она более соответствовать политик и рекомендация википедия,0
один из вещь в мой список желание это автоматически создавать карта и координата заголовок использовать поле «lat» и «long» в французский информационный окно но о это поздний кстати как только вы добавить информационный окно вы нужно проверить ссылка в немой например в сен пьер далее энтремона ссылка на район не работать просто исправить на это нужно время так что сначала я закончить корешок на сам дело я просто добавлять тот который пропустить другой говорить,0
я не собираться мириться с фанатизм и интеллектуальный нечестность если у я есть что сказать,0
правильно расставлять приоритет я не нравиться идея использовать какой либо еда в время мастрабинг я просто чувствовать что использовать еда чтобы повеселиться в то время как многие другой человек в весь мир голодать я просто не думать это очень моральный поступок,0
обсуждать не пусто в чем ваш основный неисправность нельзя ли обсудить правка прежде чем убрать они это твой pov что gadaffi неактуальный и шутка вы не оказывать никакой услуга свой народ действовать такой образ на сам дело вы быстро создать у я впечатление что турок есть что скрывать,0
коммандос nextgen recon подбираться для небольшой отряд в или человек чтобы они быть незаметный незаметный они единственный кто мочь выполнять самый опасный и любой миссия,0
дрв зайдра пена пожалуйста отменить свой версия закрытие это drv у я есть ещё несколько комментарий и ваш заключительный речь быть немного странный,0
я не хотеть быть разочаровывать кстати я украсть ваш шаблон имя пользователь он отлично выглядеть,0
эй ты долбаный гермафродит пожалуйста снять защита с ваш пользовательский страница я хотеть бы переместить он в более подходящий название или три,1
о послушать кто то удалять всё мой страница я злиться и подавлять ещё большой за то что расстроиться использовать свой здравый смысл маленький гитлер он рем перейти на каждый из мой ссылка и я должный быть добрый к он почему а как насчёт он неуклюжий характер почему никто из вы не понимать он заходить на мой страница после мой работа поддерживать удаление весь мой страница или тот кто они делать и я должный быть добрый к он я не ругаться на он а я возвращаться назад вы не полиция я иметь право злиться в ответ я не клясться маленький гитлер это не ругательство оно относиться к мелкий сотрудник правоохранительный орган такой как посетитель парк или дорожный инспектор который преследовать человек с мстительный самодовольство и без сочувствие,0
назад atcha и ты тоже спасибо привет говорить,0
ага я тоже интересно я также надеяться что вскоре быть опубликовать отчёт коронер и «все ад вырваться наружу» так что мы всё наконец смочь приступить к работа над исправление этот проблема с некоторый достоверный информация просто я ваш пробег мочь отличаться,0
хороший решение продолжать возвращать он июль г utc,0
фото на фото карпато русинский подгруппа закарпатский русин в оригинальный горский костюм из марамуреш на фото деревня мокра близ санок польша но почему они носить шаровары украинский казак в штаны,0
множество источник просто нельзя игнорировать есть несколько стать о воздействие на окружающий среда я вообще то расширить раздел в статья потому что памятник такой большой что человек должный как часть энциклопедия знать нарушение русло река я бы не согласиться с аргумент привести выше и с тем что редакция должный иметь большой расширение в статья поскольку полдюжины цитата указывать на экологический проблема также существовать постоянный конфликт интерес с сторона вышеупомянутый пользователь но из они последующий действие намерение быть ясный,0
что ты иметь в вид думать мы следовать придерживаться тот что говорить источник быть ли обнаружить другой источник в который субъект изображаться не как преступник или правило измениться так что blp большой не должный отражать то что говорить источник,0
«мн нравиться как если кто то публиковать фактический информация который не согласоваться с ваш личный политика это называется« война редактирование »»,0
прямой разговор джон сэдлера городской клерк,0
это твой папа сэм я беспокоиться за ты беспокоиться что твой член большой не влезть в мой задница omfk lolz haha я сказать пиенис горф горф горф горф,1
по слово родня кинг «разва мы не мочь просто поладить »,0
