translated_cleaned_comment,is_toxic
удалить pov я удалить отменить критика секретарь бутвелла и pov википедия не предназначить для тот чтобы подрывать репутация человек живой или мёртвый следующий быть удалить из статья бутвелла мало что сделать для изъятие бумажный деньга из обращение сформировать свой финансовый политика так чтобы предотвратить инфляция или дефляция интеллектуальный критика усмотреть в этот действие отсутствие руководящий принцип и серьёзный теоретический знание «он верить в знание настолько насколько это быть удобно для он чтобы оправдать свой собственный теория о тот что знание быть обманом» писать генри адамс в свой часто цитировать анализ в год » « он верить в обычный школа а не в другой в политология в бухгалтерский книга и кассовый книга но не в адам смит или милль как можно быть бы верить в таблица умножение но не в лаплас или ньютон исходить из естественный логика он сделать из свой неверие в высокий область политический наука основа свой политический практика и такой образ обосновать действие невежество он довести свой принцип до самый отдалить вывод » « генри адамс » « сессия » north american review июль г стр но в очень коррумпировать время о бутвелла хорошо говориться что никто не думать что он зарабатывать деньга на свой должность в кабинет министр ни для себя ни для свой друг живить в предел свой зарплата он всё время жить в пансион он единственный удовольствие заключаться в тот чтобы писать лекция и играть в бильярд или покер но не за деньга «чикаго таймс» март год «он недоступный человек не подверженный влияние страх благосклонность привязанность или надежда на вознаграждение и он не разражаться блестящий проявление любовь или ненависти» писать свой брат политик из новый англия генри ф френч бенджамин б френч март г benjamin b french papers библиотека конгресс «финансовый политика бутвелла быть менее догматичный чем прагматической» «либеральный реформатор надеяться что он поддержать реформа государственный служба и подтолкнуть страна к возобновление выплата звонкий монета но хотя бутвелла назначать подчинённый по больший часть на основа заслуга он мало что сделать для обуздание система добыча за предел вашингтон оставаться в дружеский отношение с партийный босс »,0
вы сэр идиот и извращенец,1
рекапча это не дискредитировать это относиться к компьютерный система а не к живой человек recaptcha заставлять пользователь вводить код captcha для доступ к любой услуга о который идти речь принудительный труд это определение рабский труд я собираться отменить ваш возвращение пожалуйста не делать это снова или я сообщить вы о вандализм также пожалуйста не присылать я сообщение с угроза tia,0
вопрос о возможный цитирование извинить если я пропустить ваш вопрос я не обращать особый внимание на этот страница в ответ на ваш вопрос позволить я начать с повторение мой шаблонный формулировка работа редактор википедия состоять в проверять обобщение надёжный источник с использование нейтральный точка зрение я ещё не работать над «без оригинальный исследований» wp nor говорить что мы не должный интегрировать надёжный информация чтобы прийти к новый вывод сравнение два список и вывод из они различие и сходство скорее весь являться оригинальный исследование мы мочь интегрировать информация пока не приходить к новый теория ещё один принцип который следовать помнить заключаться в тот что неопределённость повышать точность чем точнее мы быть тем сложный быть точный если перейти к деталь то веб сайт «хищник и редакторы» представляться надёжный источник поэтому мы мочь использовать он в качество источник сайт bauer даже если он несколько ненадёжный мочь использоваться в ограниченный объём в качество основный источник информация о bauer я недостаточно знак с этот тема чтобы делать вывод о тот что быть бы правильный однако я бы сказать что предложить вы текст казаться разумный источник достаточно никакой оригинальный вывод не делаться проблема с удаление веб сайт я сбивать с толк но вы смочь обобщить то что найти в надёжный источник в целое я считать что чем маленький мы говорить о предмет тем хороший атаковать статья не приветствоваться хотя мы должный показывать наш испытуемый «бородавка и всё такое» мы не должный увеличивать бородавка или игнорировать они хороший черта баланс это часть npov «но вы должный быть в состояние резюмировать то что вы найти в надёжный источниках» «нуть никакой надёжный источник только он сказать что она сказать что блог пламенный война утверждаться что закрытие сайт быть инициировать бауэр неясно сделать ли она это и другой фактор между форум и ip неизвестный это быть основный причина этот статья и всё игрок быть вовлечь через этот блог я не понимать как это мочь быть объективно бауэр я жаль что я не ответить вы о материал usenet и др но я быть несколько перегрузить на работа лично я считать что статья хороший сейчас чем когда я впервые она увидеть благодаря огромный усилие с сторона основный редактор статья чтобы собрать хороший источник и представить они так чтобы это не выглядеть толпа линчеватель вы всё делать хорошо и должный быть достаточно редактор с оба сторона чтобы гарантировать что быть опубликовать что то похожий на nuetral я рад помочь и попытаться сделать статья более аккуратный и я не хотеть показаться резкий в поле резюме но там быть много что втиснуть спасибо за замечание я ценить это я бы сказать что слово карен что я назвать она имя это выдумка я никогда не делать ничего подобный или потому что он мочь оскорблять я и называть я имя в википедия неоднократно и без последствие я обвинить она и джул в тот что они нести вода для tnh и absolutewrite и они это сделать это не слишком многозначительно я действительно устать от этот атака по этот повод это правило мафия хотя avi казаться искренний она связать с жёсткий оскорбительный племя угроза в мой адрес реальный и усиливаться с каждый час обвинение я не сделать мой аргумент менее обоснованный никто не любить когда на он наваливаться толпа это интернет эквивалент побивание камень это не выдумка я ужасно устать от тот что я называть тролль или часть толпа или культ или групповой тролль или корыстный партизан или коммандос из комментарий в блог или другой вещь который я мочь бы указать если бы я хотеть подавить себя вы также сделать «теоретический» комментарий о тот что я «любопытный толстый и некрасивый» «ести поставить перед они слово« если » это не стать менее оскорбительный я пытаться быть вежливый с вы и быть продолжать делать это но это ответ и пожалуйста заметить как и аби ави это авраам администратор аби комментатор ml который верить в доброта я советовать не накапливать обсуждение вклад это не ad hominem имя карен тем не менее вы связаться с ветка в который вы и тереза ​​назвать я псих вы должный услышать что она сказать наедине когда я попросить не говорить о я негативно в обсуждение на making light очевидный что вы двое сторонник tnh и абсолютный писатель это корыстный интерес и подкрепляться тем факт что вы бежать к она за совет что ж avi мочь принимать собственный решение по этот повод тогда не мочь sh,0
инфобокс сезон ураган это в значительный степень завершить я нужно составить некоторый документация и возможно настроить то что мочь появиться возможно вы захотеть протестировать он поэтому если есть вопрос или предложение я мочь ответить на они,0
показать я где в википедия говориться что ширина таблица должный быть коллектонский почему ты не мочь ответить на мой вопрос,0
почему этот статья быть отметить для исправление я надеяться что здесь на страница обсуждение быть какой то рекомендация для дальнейший исследование и редактирование статья выглядеть нормально для беглый чтение не читатель wiki,0
castro lite webluis продолжать возвращаться к свой разбавить предпочитать имидж кастро он не подкреплять свой правка никакой факт только сетовать на «личный нападки» некоторый несуществующий и пустой заявление март г utc,0
антонов вернуться если вы не нравиться удаление красный ссылка почему бы вы просто не добавить они в создать я таблица кроме тот вы отменить правка в который я добавить только логотип антонов так сказать в сводка редактирование,0
ещё один хрень статья попугай что сайт продвижение школа капоэйр говорить о миф о происхождение а также о преследование к конец х год капоэйр стать обозначать уличный драка такой образ власть не запрещать и не санкционировать «практику» капоэйр запрещать капоэйр они запрещать откровенный уличный драка вот почему местр бимб представить свой искусство как luta regional baiana ни один порядочный кариока не захотеть сочувствовать капоэйр и маландризмый я мочь бы попытаться изменить статья но к настоящий время она превратиться в полный беспорядок,1
я никогда не редактировать содержание ваш комментарий исправить ложный обвинение,0
повторный разговор хосе мануэль рохас,0
я согласный с тем что не должный но очевидный что это так сми делать имя супруг нарицательный мы ничего не мочь сделать чтобы это остановить но как справедливо указывать джим рейн более известный чем некоторый политический супруг из за она выдающийся положение как бизнес леди и потенциальный конфликт интерес который она пытаться избежать ник,0
по соображение безопасность редактировать война как я сказать в свой резюме редактирование термин «по соображение безопасности» неоднозначный и не установить должный образ в источник кроме тот в это нет необходимость вы понадобиться хрустальный шар чтобы знать почему они это сделать а как я уже сказать ранее джейн не идеальный причина по который всё другой производитель mg менять свой деталь чтобы они не меняться место заключаться в тот что они заставлять это делать американский batfe вдруг глка другой да я полагать это похоже на то что пистолет с компенсация glock работать не так как любой другой пистолет с компенсация интересно действительно ли они стрелять пуля,0
это свидетельствовать о ваш незрелость и непоколебимость в поведение говорить,0
македонский славянский болгарский возможно заметка республика македония признать язык как диалект македонский язык греция например распознать говорящий как славяноязычный грек болгария считать что македонский и допийский славянский македонский язык должный быть часть болгарский диасистема европейский бюро малоиспользуемый язык признание язык македонский в год этнолог наиболее полный руководство по язык мир http www ethnologue org show country asp name gr вот вы дополнительный разъяснение хотя всё мы знать позиция различный правительство есть ли у кто нибыть источник для это если да пожалуйста добавить они надеяться что этот таблица понятный но они всё ещё нужно большой нпо албания ес и так далее просьба добавлять конструктивный комментарий,0
если вы чувствовать что я действовать в поместье не в соответствие с свой обязанность вы мочь опубликовать что нибыть в википедия доска объявление для администратор инцидент если вы хотеть внести изменение в университет висконсин мэдисон и у вы есть надёжный ссылка на источник подтверждать этот изменение опубликовать ссылка с изменение этот учебник мочь помочь с ссылка если у вы есть ещё вопрос просто задавать,0
часть редактирование энциклопедия сводить экстраординарный претензия к обычный факт я предполагать что это уничижительный,0
номинация cfd в категория администратор википедия я номинировать на удаление ваш мнение по этот повод приветствоваться пожалуйста принять участие в обсуждение добавить свой комментарий на страница обсуждение спасибо ☎,0
я тоже марионетка это аккаунт suprise с уважение человек который выследить вы в интернет и убить,1
предоставляться всё необходимый источник всё что вы нужно сделать это прочитать статья но я думать вы не мочь она прочитать вы ещё раз доказывать что даже не читать статья каждый редактирование подкрепляться источник из который оно быть получить я не собираться сообщать вы какой либо подробность потому что вы просто гражданский редактор а не сотрудник википедия у вы есть весь необходимый информация в текстовый редактор pira если настоящий сотрудник википедия захотеть получить большой подробность я с радость предоставить они послушать вы явно являться сторонник анти ир который придумывать вещь чтобы поддержать свой предвзятость я ни за ни против ир у я нет предвзятость я просто сообщать факт я быть проверять этот страница ежедневно и быть продолжать отправлять свой запись pira потому что она безусловно являться наиболее точный и фактически подтвердить мы мочь делать это несколько раз в день если хотеть или вы мочь принять тот факт что мой версия хороший и просто разобраться с это решать вы но я быть регулярно редактировать или мы мочь договориться о тот чтобы объединить ваш и мой fatcxs в один статья но по три направление число лоялист убитый с по год количество жертва ир в разбивка по данные janes intelligence online и cfr и связь ир и russianmafia который быть задокументировать в многий книга и газетный источник этот три вещь поддаваться проверка и остаться,0
ты ублюдок мать ублюдок ты нечего делать как блокировать университетский компьютер идти и сосать хуй,1
это из один из многий книга о разный группа я думать что это от cult rockers но я только что проверить и supertramp там нет я поискать источник этот цитата,0
привет вы позорить человечество прекратить тратить ценный интернет ресурс убивать долбаный планета и выбросить свой компьютер ps это как час ночь какой у вы жизнь в википедия час в сутки день в неделя очень печальный и одиночный lol жизнь слишком короткий найти что нибыть хороший,1
я объяснить свой причина это блок на user talk gwen gale user professional assassin,0
при создание статья о это альбом быть создать страница значение,0
быть бы довольно странно если бы в этот рассекретить документ упоминаться фильм создать после событие к который иметь отношение и фильм и документ рассекретить документ не быть синтезировать для фильм если только вы не хотеть доказать заговор на синтез очень странно совершенно верно использовать документ относиться к один и тем же исторический событие для дальнейший проверка тот что произойти но использование первоисточник в такой случай не идеально для википедия поскольку он не идеальный поэтому я оставить он здесь на страница обсуждение если кто то захотеть изучить он большой чтобы найти идеальный ссылка,0
