translated_cleaned_comment,is_toxic
джанетта доу я ценить то что вы наслать и загрузить статья рао однако это легко мочь превратиться в бесконечный дискуссия ибо какой нибыть другой апологет ядать скоро прийти и найти ещё более неясный источник чем рао и тогда вы сознательный и строгий до такой степень что апологет ядавов не являться и не иметь намерение осознавать или не осознавать о существование уйти снова сновать за статья после это мы всё попытаться интерпретировать это взвесить всё «за» и «против» опять же до такой степень что апологет это не сделать поскольку они быть занятый поиск следующий препятствие на наш путь я думать что мы не мочь определить подавать ли рао сюда заявка или нет по крайний мера пока пусть это делать вторичный источник мы нужно полагаться на недавний стипендия особенно на учебник опубликовать академический издание и проверить как до так и после публикация рецензент из самый разный научный и журналистский круг в статья использоваться два такой книга сьюзан бейль и кристоф жафресть оба широко использовать в университет по весь мир оба из который широко рецензироваться в литература пусть написание или переписывание статья продолжиться на основа этот или подобный книга как только статья быть конкретизировать мы мочь вернуться к вопрос о рао в противный случай ничего не быть сделать и тот из мы кто взять тайм аут из другой наш занятие в википедия не говорить уже о rl чтобы уделить внимание статья медленно уйти терять связь и из за сочувствие говорить,0
не согласный хорошо известно что список персонаж подходить для википедия,0
отказ от ускоренный удаление навино соня привет muffledthud я просто сообщать вы что я отказаться от скорый удаление naveen sawhney страница который вы пометить для скорый удаление из за следующий проблема в статья содержаться достоверный утверждение о важность или значимость достаточный для прохождение a спасибо соединить королевство,0
эй пойти ты кто черта взять проверять заповедник дикий природа пном мы лир на вандализм получить грёбаный жизнь дерьмо мешок,1
блокировка диапазон проксить возможный побочный ущерб вы звонить смотреть обсуждение пользователь cubbieco так как это ваш блок а я сам не особо помогать с проксить оставить это на ваш усмотрение talk contribs,0
криминальный чтиво вы бы порекомендовать это,0
rsa labss теперь emc mit и acm ошибаться vquaker я привыкнуть принимать исправление когда они должный быть внести но хоть убить я не мочь понять почему цитировать информация из первоисточник rsa labs по четвёртый фактор аутентификация не заслуживать внимание я столкнуться с информация о тот что поскольку это не являться юридический требование насколько вы известно оно должный быть ложный некоторый человек знать что правовой информация хороший получать из государственный источник а не из википедия если вы выставлять этот ресурс как какой то тип руководство экспозиция или санкционировать ресурс cfr или usc то я считать что правительство сша хотеть бы услышать ваш идея кроме тот «кто то кто вы знаете» или знать вы являться часть сетевой администрирование что являться часть блеск трудно победить потребность в когорта или наблюдатель обеспечивать человеческий фактор хотя подозревать вы это уже знать я не обиженный я просто очень смутить тем почему этот элемент управление доступ должный быть лишить технический информация и соответствовать какой то произвольный правовой стандарт я хотеть бы спросить вы если пользователь терять свой смарт карта то есть cac и забывать свой пароль при условие что биометрический устройство или другой методология фактор принадлежность не развернуть в большинство ситуация администратор знающий пользователь спрашивать они быть уволить или они перевыпускать учётный дать знать человек есть организация который уволить вы но я не мочь сказать это в свой изложение четвёртый фактор потому что это означать бы цитирование информация недоступный для непрофессионал я действительно надеяться что смочь «говорить» не цитировать то что представитель df и is счесть бы общеизвестный когда мы отправиться в путь мы должный быть предоставить надёжный информация если миссия измениться ну кто мочь сказать считать что я с это момент не участвовать в программа мы в любой случай не разрешаться использовать википедия там где я работать это анафема сказать что хотеть если это не удивить кто то и тогда выдаваться проверка на эгоизм в конец конец я учить тон измениться из за ваш тупость и использование бессмысленный пример который нельзя использовать для аутентификация кто либо запах непоследовательность вы дать я почитать но я всё ещё ждать когда вы процитировать политика википедия согласно который информация подлежать юридический санкция и в формат ожидать адвокат я процитировать свой источник где цитироваться что стиль организация и применимость язык соответствовать один или несколько регулировать орган теперь хороший способ проявить инициатива это осознать что академический база данные есть ли у вы доступ к они elsevier jstor edas ieee springerlink они мочь быть дорогой если вы попытаться но без они вы застрять в гугл фанк но я отвлечься полно ссылка на четвёртый фактор этот ключ от касса менеджер использовать когда вы что то возвращать да кто то кто вы знать это существовать уже несколько десятилетие зарегистрировать учётный запись у интернет провайдер и вот она радоваться знать что у вы есть звезда шериф и вы по больший часть готовый помочь я просто не понимать что вы один устанавливать этот стандарт я раскаиваться в пепел и соответствовать образ раздирать свой вретище,0
привет шанкс я видеть как вы много делать в спорт особенно в греческий команда и спорт мочь я спросить поддерживать ли вы греция в весь вид спорт вы следить за чемпионат мир по водный полый среди женщина когда греция выиграть золотой медаль как вы думать сколько медаль выиграть греция в лондон в год дать я знать спасибо,0
банкнот в доллар сша не знать но у я есть банкнот в доллар она зелёный цвет и с баран кто нибыть знать что это я он отсканировать и скоро выложить,0
июнь г utc эммм я действительно спроектировать и построить витрина вы действительно говорить я о чем я думать когда делать это скрытие трещина быть оригинальный а не единственный причина другой дело что витрина «выступает» весь на дюйм в несколько место и ​​в основное отступать от линия застройка на фут создаваться впечатление что он болтаться над тротуар я выкопать фотография витрина сбоку если она вы порадовать крис оствальда,0
arghhh мочь кто нибыть разобраться в он местонахождение,0
хорошо я полагать мочь решить хотеть ли они удалить комментарий так ц,0
эй какой хрен твой проблема возиться с мой страница оставить это черта взять в покой,1
привет чем мочь помочь ответить,0
и более подробный информация о он различный должность в нефтяной отрасль,0
mfd пропустить спасибо бросить с уважение обсуждение,0
некоторый из тот кто мы знать заявить бы это как или но я не быть как я уже сказать если вы хотеть чтобы gb возможно найти источник который это говорить,0
туберкулёз страница по dots rntcp я недавно запустить wikipage на rntcp и только поздний я понять что вы ранее внести большой вклад в развитие туберкулёз и что обсуждать необходимость включение интеграция dots в wikipage для лечение туберкулёз теперь казаться странный иметь отдельный страница для rntcp без страница для dots что я делать,0
я бы сказать что это дурной тон но весь спор я утомить и я действительно не хотеть вмешиваться,0
февраль г пожалуйста остановиться если вы продолжить разрушать википедия вы быть запретить редактировать она говорить если это общий ip адрес и вы не внести изменение подумать о создание учётный запись для себя чтобы избежать дальнейший нерелевантный уведомление,0
нет тхэквондо в это год или мочь быть в последующий год быть в первый семестр из за тот что волейбол попасть в второй семестр я пока не знать истинный результат турнир по тхэквондо деталь плавание обратить внимание что рейтинг на чемпионат по плавание основать на общий количество очко набрать команда а не только на медальный зачёт и если возможно указать всё медаль предлагаться разместить в таблица следующий заголовок команда очки золото серебро бронза общий,0
бакроним у я такой чувство что я где то читать что название тардис это фон или фартук имя появиться первый а то что оно обозначать появиться поздний я право если так то это безусловно должный быть отразить в статья однако я сделать быстрый поиск в google и не найти ничего что указывать на это я мочь ошибаться,0
собственный имя имя это женский или мужской,0
sockpuppetry чехол ваш имя быть упомянуть в связь с дело о носок пожалуйста обратиться к википедия расследование sockpuppet поклонник доктор карла за доказательство перед редактирование страница доказательство обязательно ознакомиться с руководство по реагирование на дело ˜ говорить вклад,0
рельс я сомневаться что rails это архитектура без совместный использование ресурс по умолчание у он есть сеанс на основа файл а также один исполнитель процесс который не сбрасываться между запрос если вы установить глобальный переменный в один запрос она быть там и в следующий при условие что вы оказаться на тот же сервер,0
что касаться аргумент который следовать включить то это уже есть wanker использоваться очень часто но только как существительное нарицательный и это слово не являться уникальный то же самый и с другой упомянуть слово хотя другой страна содружество например новый зеландия мочь использовать влагалище аналогичный образ австралиец похоже использовать он частый однако этот аргумент неуместный поскольку многие «австралийские» слово такой как «товарищ парень» и так далее широко использоваться в новый зеландия и великобритания хотя всё ещё присутствовать в статья rm,1
второй проект википедианец против цензура это циничный троллинговый кампания проводить горгонзилла хорошо известный проблемный пользователь быть бы совершенно неуместно они объединять эрвин,0
я против объединение стать я думать что часть путаница заключаться в тот что интерпретировать афроамериканец как чисто этнический ярлык если бы это быть так аргумент иметь бы смысл но это не так так это ярлык который указывать как на этнический принадлежность человек так и на он национальность,0
спасибо гарета это очень любезно интересно действительно ли этот холм сделать из рыхлый песок если да то как они мочь остановить он проседание под дождь дизайнер в я думать о практичность,0
организация тоже считаться вещь раздел который вы цитировать из wp name находиться в раздел под название использовать английский слово в который говориться иногда обычный английский версия быть несколько отличаться от местный форма как у франц йозеф штраус и редко как в случай с эверест всё быть совершенно иначе » « это явно тот случай когда «обычный английский версия» «несколько отличаться википедия соглашение о имя политический партия иметь несколько исключение третий исключение это «партия название который более широко известный по аббревиатура чем они полный название в международный средство массовый информации» «посколька отс более широко известно по аббревиатура это соглашение о имя не применяться нет проблема с двусмысленность поскольку в википедия нет другой тем носить название gpv даже если бы они быть этот статья быть бы назвать gpv политический партия чтобы устранить они неоднозначность в заключение пожалуйста прочесть полностью соглашение о имя прежде чем цитировать они я также пожалуйста продемонстрировать что gpv не являться наиболее часто использовать английский название для этот вечеринка что вы ещё не сделать спасибо,0
тангенциальный сила касательный сила кориолис и эйлер мочь быть применить к система но они не возникать естественный образ за исключение возможно электромагнетизм но это не по тема на прошлый неделя быть довольно много дискуссия о сила эйлер и сила ориолис наряду с ложный утверждение о тот что я запутаться между они мы мочь применить к система сила кориолис или сила эйлер если захотеть сила эйлер увеличить угловой ускорение а сила кориолис изменить направление ограниченный совместный вращение радиальный движение в вращаться система отсчёт с неоднородный угловой ускорение быть действовать фиктивный сила эйлер действовать по касательная на кеплеровский орбита быть нулевой тангенциальный ускорение хотя можно видеть что этот ноль являться сумма продолжаться равный и противоположный сила эйлер и сила кориолис сказать всё это тангенциальный сила не иметь большой отношение к этот статья о они можно быть бы упомянуть попутно но в статья речь идти о радиальный сила центробежный сила это внешний радиальный сила редактор следовать предпринять большой попытка сосредоточиться на дифференциальный уравнение в переменный «радиальный расстояние» они мочь начать понимать что такой центробежный сила,0
спасибо что указать почему вы это сделать этот учётный запись пользоваться несколько пользователь и я не знать какой изменение они мочь внести вот почему я смутить сообщение на мой страница пользователь спасибо,0
да вы правый теологически католицизм сильно отличаться от американский протестантизм который породить креационистский движение и конечно же не интересоваться фундаменталистский теократия который хотеть большинство из они конечно они использовать телеологический аргумент но формулировать он на богословский язык который сильно отличаться от научный язык и следовательно это не псевдонаука что раздражать я как учёный но я не разбираться в теология вероятно потому что я научить мыслить слишком научно и католический церковь в большинство случай иметь дело важный чем делать заявление по научный вопрос но католик действительно любить власть поэтому то что говорить иерархия идти дунк ☺,0
о gwh ты действительно плохой админ в википедия да помиловать бог твой бедный жалкий толстый некрасивый душа,1
разблокировать что за ебать статья о энн килкенни быть написать плохо я переписать она чтобы она не выглядеть дерьмо посмотреть на мой последний правка грёбаный тупица,1
кроме тот даже если предположить что ваш условие быть в сила трехнедельный блокировка за нарушение ограничение поставить вместо часовой являться совершенно несоразмерный и являться отличный пример wp game блокировка наказание в десять раз длинный исходный блок,0
