translated_cleaned_comment,is_toxic
отбор аккаунт ok blueboy разработка из l gng l быть отключить blueboy по следующий причина вернуться из часовой блок и забрать он сразу назад вверх снова и судить по история не вероятно получить он для это это назвать внимание на тема который быть решить прежде чем любой из вопрос быть рассмотреть есть модератор удалённый предмет история wikipedia и модератор borgqueen s редактирование куйсин гавайи быть просто провокация и ничего большой я известный шеф повар тихоокеанский римский кухня и кухня гавайи и кухня гавайи не местный обед плита что похоже на то что кухня мексика заморозить берритос или что кухня канада это выпечка starbucks или что кухня америка макдональд он славный вкусный и вежливый главный точка здесь почему админ в вопрос удалить история и нет это не решить до тот пора пока этот проблема не быть адресовать и я пойти обсудить он с это пользователь сразу и мой аккаунт быть закрытый что пользователь не открыть для рассчита или отказать что админ суферы бог комплекс и любовить я от даже лицо мой собственный страница точно быть независимымываться на последования и я не оставлять здесь чтобыть перруптить админфик назадывать насльтечение и сваний не вероятно get это eh buddy выслушать вы быть удалять мой страница пользователь и учётный запись из вика grommet вы не собираться блокировать я и сохранить мой имя контент или профиль я из это фасад который являться википедия для хороший удалить всё сейчас роммета »,0
listas сабина бавария,0
плохой редирект пожалуйста удалить перенаправить с страница x c что самолёт быть отличительный отличаться в дизайн строитель миссия и так далее и восстановить что самолёт уникальный контент на он страница тело,0
большой информация спасибо за введение этот статья есть несколько ошибка который я исправить быть бы хорошо если бы вы не просто отрезать и вставить текст из статья очистить озеро,0
он имя быть трой тедфорд а не трой тельфорд я смотреть на он устный дискомпресс бумага прямо сейчас у я также есть он фиолетовый сердце с olc человек быть войный герой в сам большой мировой война я сам историк степень история получить декабрь от ату,0
интересно отметить что оба самолёт приземлиться на один аэродром на гавайи,0
спасибо за это опять восхитительный изображение,0
и я хотеть бы зажать на они,0
а человек также создать новый слово даже после тот как современный язык уже быть установить,0
» это в история или более удобно в ваш собственный список спасибо за объяснение но это не быть большой сделка я быть более расстроить ваш второй пост отвести я с племянник о рост более толстой кожа и палец околоть о профанитет отыскивать я как оскорбительный кусок интернет полемика а не согревать человек пытаться дать честный счёт себя аккаунт который mackensen быстро удаляться как вы говорить ну я понимать что пытаться внести свой вклад в мастерская быть плохой идея в первый очередь — бежать полный наклон в тони сидауэй после тот как управлять чтобы избежать он на irc в течение целое месяц к неизмеримый улучшение мой качество жизнь в любой случай я всегда видеть вы как кто то кто стоить за подводный — я помнить как выглядеть ваш дополнение это редактирование в гид по гарассмент — и я быть грустный чтобы увидеть не быть взаимность уважение говорить,0
некоторый тип и на мыльный коробка,0
» да они действительно я заменить что второй с резюме женский право говорить,0
любой человек мочь сделать в текст поиск и и увидеть статья не полагаться главный образ на один источник издатель на сам дело общий объём два цитата ссылаться на издатель являться для чистый факт такой как количество предмет который находиться в библиотека часть,0
gore ответ мочь ли кто нибыть найти ответ gore на малапро буш почему не гора как изобретатель смелый вещь клуб он глупо после это,0
pls дать ответ да или нет,0
» ни один из два добавить цит не поддерживать утверждение миссконцепция дефис и дэш являться одинаковый глиф оставаться неисправный и как рядом как я мочь сказать что есть только один человек который делать это утверждение несмотря на всё претензия «консенсус»» неисходный материал удаляться это политика вика я дать вы месяц чтобы найти источник или пересловить запись чтобы он отражать что источник на сам дело говорить я восстанавливать цитата необходимый тег и если нет источник в день или так вход быть удалённый »,0
краткий резюме ссылаться на основной faqs для организация я заметить что вы также разглашать ассоциация с frank на ваш страница пользователь спасибо за это это делать работа с вы и знать где вы приходить из гораздо лёгкий если у вы есть какой либо вопрос о мой обзор ваш статья не стесняться оставить я сообщение или отправить я электронный письмо ура соня брат »,0
для ваш информация вы уже быть сообщить справедливо поговорить о себя и свой отказ от возможность предоставить актуальный информация который являться фактический от размещение вы очевидный предать праздник и неуместный представитель для википедия,0
то же самый для файл seankilpatrick jpg и файл connorbarwincincy png,0
y r мы делать это пэт,0
» спасибо за копирайт omg он так профессионально читать я очень ценить это да я знать что это быть проблема ладный вот история обратный связь к он дэнни иметь краска тело пока он быть робот в время эскиз в время после вечеринка в который тема быть чёрный свет всё мочь увидеть что дэнни ещё покрашалый на он так как не стираться или что то чтобы быть уверенный джек иметь чёрный свет переключатель в свой квартира и когда liz прийти он получить он который привести к liz иметь краска по весь она смотреть здесь или если что то что я только что сказать не иметь смысл читать здесь и здесь о краска ещё на дэнни и чёрный удар по свет да я думать мочь если человек увидеть что ga примечание они не оставить я сообщение хотя что не работать как пользователь оставить я сообщение о статья который я рассмотреть это должный работать в будущее я нужно сделать это хороший я до сей пора не получить шанс увидеть он но я должный увидеть он я нужно знать что произойти и вещь ну после тот как я получить новость который он потерять я начать смотреть свой dvd и говорить себя что я никогда не увидь он борьба снова двигаться я не плач я просто печальный ночь на равно я потерять он и плакать что бы я не думать что быть круто шон не ум но я сделать не на сам дело я до сей пора не видеть что лицо как качество он я думать что они быть играть randy вне как triple h вы знать хорошо с толпа но всё ещё есть он heel ish мочь быть причинить весь новый человек каблук и они нужный некоторый лицо кто знать говорить о рэнди сегодня он день рождение исполниться ну если ты помнить он первый «запугла» жертва быть шон так приятно видеть что он сделать это комедия всё в сюжетный линия nici добро пожаловать на даниэльсон и миз я думать хит,0
if width style background прозрачный width style background color style width border px твёрдый фоновый цвет вертикальный align top здравствуйте лцелик и добро пожаловать в википедия пожалуйста не забыть подписать ваш имя на страница разговор нажать или использовать четыре наклон это автоматически произвести ваш имя пользователь и дата также пожалуйста сделать всё возможный чтобы всегда заполнить поле резюме редактирование ниже привести некоторый полезный ссылка чтобы облегчить ваш участие счастливый редактирование width style background color style width border background color вертикально align top начало введение пять столп википедия как редактировать страница интуитивный руководство к википедия найти свой путь вокруг таблица содержимое каталог отдел редактирование стать как разработать статья руководство стиль style width border background color вертикально align top width cellpadding style vertical align top фоновый цвет получить помощь style color часто задавать вопрос чехать где задать вопрос помощь страница страница помощь новый участник статья wizard мастер который помочь вы создавать статья,0
» я не знать как это должный быть но я большой сторонник x файл и я как видно почти каждый эпизод и не один раз он упоминать что мюдёр являться отец scull y baby не мочь смотреть очень осторожно мочь ли вы сын уильям мудёр часто ссылаться на в окончательный эпизод только с вершина мой голова охрана а что ты думать мюдёр «мыть сын он мать » скулль «наш сын мюдёр я он отдать наш сын я так бояться что ты никогда не простить меня» не говорить уже о значимый выглядеть что мюдёр и скулла давать друг друг когда оскорбитель на слух просить «агент скулль не правда ли что вы и мюдёр быть любовник и вы беременный и иметь он любовный ребёнок »,0
цитирование rèf saumur v город квебек s c r § окончание розаика,0
образование пожалуйста сохранить список колледж в питтсбург список колледж в питтсбург если вы не семейный с район не редактировать этот список гренсбург вашингтон mccandless и калифорния не в питтсбург пожалуйста не обижаться когда я применить это также адрес рассылка pittsburgh не означать что школа находиться в питтсбург адрес распространяться далеко в некоторый место в минута езда спасибо,0
пока вы не найти способ поставить цит который быть на страница обратно я пропускать здесь,0
мы потомок otman baba trough mehmed ali karakoç sunni muslim s и не alevis,0
мочь ли вы уточнить хотеть чтобы я начать rfc я не видеть что один быть указать в история страница talk rasmussen reports,0
атеизм полный шип,1
» ты бить я к она просто хотеть сказать хороший работа чтобы бить я в отвращение статья ned kelly я всегда наслаждаться они когда я знать что кто то другой находиться на охота для вандал счастливый охота шахта pro,0
вы удалить ссылка на тот же ссылка использовать в исследование здоровье который говорить что сокращение использование вакцина mmr являться почему ребёнок waldorf иметь маленький аллергия из раздел на иммунизация wtf считать ли дать из весь калифорния для вы частный и общественный школа waldorf в калифорния иметь «личный уровень освобождение от пчеловодства» в размер до от они детсадный занятие независимо от тот что такой официальный позиция и я утверждать здесь но не бы сделать это в статья что позиция официальный быть ложь чтобы образование waldorf не появиться как полный культ студент waldorf в целое под вакцинировать тот факт должный быть в статья,0
спасибо за это я быть принимать глубокий дыхание и идти в интро завтра я определить источник фраза лондон на граница и показать что граница состязать в сноска я опровергать раздел диаспора и оправдать заявление ссылаться на статья история виктория на west ham и east ham надеяться я быть бороться с обоснование не существенно менять результат предыдущий дискуссия затем перейти к стандартизация ссылка вероятно раздел по раздел,0
немецкий статья день дорога джимбо немецкий wikipedia с гордость представлять статья день http de wikipedia org wiki wikipedia hauptseite действительно захватывать действительно удивительный стоить glimpse http de wikipedia org wiki fremdk c brper in anus und rektum вы мочь улучшить свой немецкий чтение он есть много чтобы учиться ваш искренне,0
я согласный как я галантий заявить что это периферия к основной статья но тем не менее важно потому что я просто недоверять мифомания пропагандировать оба сторона мой единственный интерес здесь исторический реальность dab почему вы на сам дело не анализировать ситуация а не предлагать свой обычный смарт алексический замечание препирание лонтех быть снять к деталь кратко и каждый раз это происходить он участвовать в тангенциальный и ирррационный поведение commonsense рассказать вы что в дарданий не быть долгий состояние или королевство мы мочь t просто позволить интро абзац читать как некоторый kla рекрутинг веб сайт,0
я найти один сортировка как угодный сайт для jewishforlife org не загружаться но у я есть статья из они в католический источник я собираться удалить ошибочный предложение сейчас в инсайт быть бы здорово если этот незначительный вопрос контент мочь быть решить с ссылка в первый очередь,0
» я предоставить много справочный материал но вы не предоставить всё письмо в раздел chamar поступать из источник который являться верный вы ещё не предоставить вы один с eccentric idiology вы всё ещё не предоставить любой ошибной источник чтобы показать что ramdasia и chamar отличаться chamars который взять ткачество известный как ramdasia s простой поиск google на ramdasia chamar предоставить вы бесчисленный ссылка bal,0
блокировать evading ip заблокировать парень,0
я видеть что он иметь ряд цитата на pubmed,0
эй почему вы распространять заблуждение и пытаться распространять ложный информация человек вы даже не знать кто выиграть битва и кто потерять ты самый дешёвый человек на земля кровавый игнорантный обман проверить источник перед распространение слух,1
я должный добавить здесь для любой админ с учёт тот что я быть заблокировать в течение час пользователь сарек вулкан неделя назад так что есть большой фон если это актуально и я должный быть узнать мой урок тогда пакс говор,0
изменение имя пользователь запрос на страхование запрос ещё в прогресс mb m → mmitra привет я просить о изменение имя пользователь с помощь узурпация от мб м → ммитра это почти день с дата запрос но всё ещё он показывать в прогресс я хотеть бы знать сколько время требоваться для завершение запрос и сколько время это занять чтобы завершить пожалуйста ответить как можно скорее спасибо ссылка мб м → ммитра,0
utc декабрь,0
потому что в противный случай pov посмотреть на flemish лингвистика дело,0
да mainsprings использоваться в некоторый часы а также пожалуйста не стесняться быть смелый и помочь улучшить статья,0
обычный термин использоваться немецкий политик по путь я получить он оттуда »,0
держать оригинальный название в xbox хотя вы мочь иметь дополнительный лайк такой как xbox и x box который перенаправляться в этот статья,0
» а ты дать я знать когда вы вы выползти из свой арсей dick laurent мёртвый,1
